{
  "name": "conventional-commits",
  "description": "Conventional Commits workflow with Co-Authored-By enforcement hook. Includes the conventional-commits skill and a PreToolUse hook that blocks AI attribution lines from commit messages.",
  "version": "1.0.0",
  "author": {
    "name": "Vinicius Rocha"
  }
}
